{
	"$schema": "../schema.json",
    "Class": "Point",
    "base": [
        "Monster",
        "Target",
        "RenderFields",
        "Angles",
        "CustomModel",
        "Unkillable",
        "Sequence"
    ],
    "studio": "models/pit_worm_up.mdl",
    "data": {},
    "title": "monster_pitworm_up::classname",
    "description": "monster_pitworm_up::classname::description"
}