{
	"$schema": "../schema.json",
    "Class": "Solid",
    "base": [
        "Global",
        "RenderFields",
        "PlatSounds",
        "minlight",
        "ZHLT"
    ],
    "data": {
        "spawnflags": {
            "choices": {
                "1": {
                    "title": "func_plat::spawnflags::1",
                    "description": "func_plat::spawnflags::1::description"
                }
            }
        },
        "height": {
            "variable": "integer",
            "value": "0",
            "title": "func_plat::height",
            "description": "func_plat::height::description"
        },
        "speed": {
            "variable": "integer",
            "value": "50",
            "title": "func_plat::speed",
            "description": "func_plat::speed::description"
        }
    },
    "title": "func_plat::classname",
    "description": "func_plat::classname::description"
}