{
	"$schema": "../schema.json",
    "Class": "Point",
    "base": [
        "Target",
        "Angles"
    ],
    "size": [
        [
            -4,
            -4,
            -4
        ],
        [
            4,
            4,
            4
        ]
    ],
    "color": [
        0,
        255,
        0
    ],
    "title": "info_intermission::classname",
    "description": "info_intermission::classname::description"
}