{
	"$schema": "../schema.json",
    "Class": "Solid",
    "base": [
        "Target",
        "Global",
        "Master",
        "RenderFields",
        "Angles",
        "minlight",
        "ZHLT",
        "ReplacementFiles"
    ],
    "data": {
        "changetarget": {
            "variable": "target_destination",
            "value": "",
            "title": "func_rot_button::changetarget",
            "description": "func_rot_button::changetarget::description"
        },
        "speed": {
            "variable": "integer",
            "value": "50",
            "title": "func_rot_button::speed",
            "description": "func_rot_button::speed::description"
        },
        "health": {
            "variable": "integer",
            "value": "",
            "title": "func_rot_button::health",
            "description": "func_rot_button::health::description"
        },
        "sounds": {
            "variable": "sound",
            "value": "buttons/level1.wav",
            "title": "func_rot_button::sounds",
            "description": "func_rot_button::sounds::description"
        },
        "wait": {
            "variable": "choices",
            "value": "3",
            "choices": {
                "-1": {
                    "title": "func_rot_button::wait::-1",
                    "description": "func_rot_button::wait::-1::description"
                }
            },
            "title": "func_rot_button::wait",
            "description": "func_rot_button::wait::description"
        },
        "delay": {
            "variable": "string",
            "value": "0",
            "title": "func_rot_button::delay",
            "description": "func_rot_button::delay::description"
        },
        "distance": {
            "variable": "integer",
            "value": "90",
            "title": "func_rot_button::distance",
            "description": "func_rot_button::distance::description"
        },
        "spawnflags": {
            "choices": {
                "1": {
                    "title": "func_rot_button::spawnflags::1",
                    "description": "func_rot_button::spawnflags::1::description"
                },
                "2": {
                    "title": "func_rot_button::spawnflags::2",
                    "description": "func_rot_button::spawnflags::2::description"
                },
                "32": {
                    "title": "func_rot_button::spawnflags::32",
                    "description": "func_rot_button::spawnflags::32::description"
                },
                "64": {
                    "title": "func_rot_button::spawnflags::64",
                    "description": "func_rot_button::spawnflags::64::description"
                },
                "128": {
                    "title": "func_rot_button::spawnflags::128",
                    "description": "func_rot_button::spawnflags::128::description"
                },
                "256": {
                    "title": "func_rot_button::spawnflags::256",
                    "description": "func_rot_button::spawnflags::256::description"
                }
            }
        }
    },
    "title": "func_rot_button::classname",
    "description": "func_rot_button::classname::description"
}