{
	"$schema": "../schema.json",
    "Class": "Point",
    "base": [
        "Target",
        "CBaseDelay",
        "Angles",
        "RenderFields",
        "Ammo"
    ],
    "studio": true,
    "data": {
        "model": {
            "variable": "studio",
            "value": "models/w_gaussammo.mdl",
            "title": "CustomKeys::model"
        }
    },
    "title": "ammo_gaussclip::classname",
    "description": "ammo_gaussclip::classname::description"
}